Title,Published Date,Location,URL
HabitusHusene Sct. Mortensgaard søger pædagogiske medarbejdere,2024-04-09,Hurup Thy,https://www.jobindex.dk/vis-job/h1458725
Category Manager,2024-04-09,Aalborg,https://www.jobindex.dk/vis-job/h1458722
Reservedelssælger,2024-04-09,Aalborg,https://www.jobindex.dk/vis-job/h1458718
Data Governance Analyst til data drevet forretningsudvikling hos Wrist,2024-04-09,Nørresundby,https://www.jobindex.dk/vis-job/h1458714
Maskinkonstruktør,2024-04-09,"Vejle, Aalborg eller Albertslund",https://www.jobindex.dk/vis-job/h1458668
Teknisk projektleder,2024-04-09,"Vejle, Aalborg eller Albertslund",https://www.jobindex.dk/vis-job/h1458655
Project Assistants for Danish Transcription,2024-04-09,unknown,https://www.jobindex.dk/vis-job/h1458625
Head of Business Finance,2024-04-09,Aalborg eller København,https://www.jobindex.dk/vis-job/h1458612
Kontorchef til regnskabsafdelingen i Forsvarsministeriets Regnskabsstyrelse,2024-04-09,Hjørring,https://www.jobindex.dk/vis-job/h1458585
Accounting Manager,2024-04-09,Hjørring,https://www.jobindex.dk/vis-job/h1451511
ERP-forretningskonsulent / Teamlead,2024-04-09,Nørresundby,https://www.jobindex.dk/vis-job/h1451494
"Business Controller, Global Procurement",2024-04-09,Nørresundby or Hvidovre,https://www.jobindex.dk/vis-job/h1451486
Talent 2024: Vil du være med til at levere kritiske it-løsninger til det offentlige segment,2024-04-09,"Aarhus, Aalborg og Ballerup",https://www.jobindex.dk/vis-job/h1451208
Odense Skolefoto søger fotografer,2024-04-09,unknown,https://www.jobindex.dk/vis-job/h1449747
Er du vores næste fotograf?,2024-04-09,unknown,https://www.jobindex.dk/vis-job/h1449741
Din detailkarriere starter i Lidl: Bliv butikselev i Jylland eller på Fyn,2024-04-09,unknown,https://www.jobindex.dk/vis-job/h1443085
Hegnsmontører,2024-04-09,unknown,https://www.jobindex.dk/vis-job/h1436783
Kreditspecialist til Region Nordjylland,2024-04-09,unknown,https://www.jobindex.dk/vis-job/h1458785
Skibsagent,2024-04-08,Aalborg Øst,https://www.jobindex.dk/vis-job/h1458558
Fonden Føniks udvider og søger en afdelingsleder til Nordjylland,2024-04-08,Dronninglund,https://www.jobindex.dk/vis-job/h1458531
Airloq Servicetekniker,2024-04-08,Mariager,https://www.jobindex.dk/vis-job/h1458524
Montør til automatiseringsprojekter,2024-04-08,Nykøbing M,https://www.jobindex.dk/vis-job/h1458518
Teamleder i Service,2024-04-08,Mariager,https://www.jobindex.dk/vis-job/h1458452
Erfaren debitorbogholder med fokus på inkasso til leasingselskab,2024-04-08,Aalborg,https://www.jobindex.dk/vis-job/h1458444
Er du vores nye butikssælger i INTERSPORT Outlet?,2024-04-08,Aalborg SV,https://www.jobindex.dk/vis-job/h1458434
Key Account Manager – tekniske produkter til grossister,2024-04-08,unknown,https://www.jobindex.dk/vis-job/h1458421
Robot Software ingeniør med fokus på avanceret kontrol og applikationsudvikling,2024-04-08,Aalborg SV,https://www.jobindex.dk/vis-job/h1458403
El-Konstruktør/Projektleder,2024-04-08,"Aalborg, Vejle eller Albertslund",https://www.jobindex.dk/vis-job/h1458357
Project Engineer - Controls,2024-04-08,Arden,https://www.jobindex.dk/vis-job/h1458319
"Udadvendt fysio/ergo-terapeut, der vil være med til at gøre en forskel",2024-04-08,Aalborg SV,https://www.jobindex.dk/vis-job/h1458296
Regnskabschef,2024-04-08,Aalborg,https://www.jobindex.dk/vis-job/h1458281
Sagsbehandler til skattefri virksomhedsomdannelse,2024-04-08,Aalborg,https://www.jobindex.dk/vis-job/h1458225
Sommerferieafløsere til produktion,2024-04-08,Aars,https://www.jobindex.dk/vis-job/h1458165
Er du vores nye procesoperatør til Food Oil i Agersted?,2024-04-08,unknown,https://www.jobindex.dk/vis-job/h1458156
Forsikringsrådgiver til Region Østvendsyssel,2024-04-08,"Hals, Vodskov, Frederikshavn, Sæby, Skagen, Hjallerup og Dronninglund",https://www.jobindex.dk/vis-job/h1458154
Rejsemontører,2024-04-08,Aalborg,https://www.jobindex.dk/vis-job/h1458090
Genbrugsvejleder,2024-04-08,unknown,https://www.jobindex.dk/vis-job/h1458072
Ferslev El har rigtig travlt og søger endnu en dygtig og engageret elektriker med erfaring og interesse i både større og mindre projekter,2024-04-08,Svenstrup J,https://www.jobindex.dk/vis-job/h1458029
Priskoordinator til EL-Installation,2024-04-08,"Herlev, Odense, Kolding, Åbyhøj, Aalborg eller Slagelse",https://www.jobindex.dk/vis-job/h1456953
Dækmontør søges til Frederikshavn,2024-04-08,unknown,https://www.jobindex.dk/vis-job/h1451085
Projektleder med interesse for CO2 og energi,2024-04-08,Aalborg Øst,https://www.jobindex.dk/vis-job/h1450948
R&D Test Engineer,2024-04-08,Frederikshavn,https://www.jobindex.dk/vis-job/h1450868
Mediesælger med teamleder-potentiale,2024-04-08,unknown,https://www.jobindex.dk/vis-job/h1450839
DoE & Parametrization Engineer,2024-04-08,Frederikshavn,https://www.jobindex.dk/vis-job/h1450824
Passioneret Marketingchef søges,2024-04-08,Aabybro,https://www.jobindex.dk/vis-job/h1450779
Entrepriseleder med erfaring fra branchen,2024-04-08,Støvring eller Tune,https://www.jobindex.dk/vis-job/h1450543
"Er du på udkig efter et fleksibelt studie- eller deltidsjob med mening, der samtidig styrker dit CV?",2024-04-08,unknown,https://www.jobindex.dk/vis-job/h1450436
Selvkørende servicetekniker,2024-04-08,Mariager,https://www.jobindex.dk/vis-job/h1450174
Er du vores næste fotograf?,2024-04-08,unknown,https://www.jobindex.dk/vis-job/h1449928
Category Manager - Prefabrication,2024-04-08,Aalborg Ø,https://www.jobindex.dk/vis-job/h1447666
Erhvervsrådgiver til Erhverv Jammerbugt,2024-04-08,Aabybro,https://www.jobindex.dk/vis-job/h1442966
Erhvervstrainee til Erhverv Jammerbugt,2024-04-08,Aabybro,https://www.jobindex.dk/vis-job/h1442965
Erfaren konstruktør eller ingeniør,2024-04-08,Farsø,https://www.jobindex.dk/vis-job/h1442735
Category Manager - med primært fokus på projektindkøb,2024-04-08,Arden,https://www.jobindex.dk/vis-job/h1442608
Montør – få stor indflydelse i en 4-dages arbejdsuge,2024-04-08,unknown,https://www.jobindex.dk/vis-job/h1410790
"Servicemedarbejder søges til DTU Aqua, Nykøbing Mors",2024-04-08,unknown,https://www.jobindex.dk/vis-job/h1458412
Autoriserede psykologer med egen klinik,2024-04-08,unknown,https://www.jobindex.dk/vis-job/h1458381
Er du vores nye salgskonsulent i Nordjylland?,2024-04-08,Aalborg SV,https://www.jobindex.dk/vis-job/h1458378
Landbrugsmaskinmekaniker,2024-04-08,"Hinnerup, Kolding, Brønderslev eller Aalestrup",https://www.jobindex.dk/vis-job/h1458368
Attraktivt job som sælger hos XL-BYG Hadsund,2024-04-08,unknown,https://www.jobindex.dk/vis-job/h1458302
Engageret lagermedarbejder søges til XL-BYG Farsøs ekspeditionslager,2024-04-08,unknown,https://www.jobindex.dk/vis-job/h1458291
Projektleder med teknisk erfaring,2024-04-08,"Vejen, Brøndby, Aalborg eller Aarhus N",https://www.jobindex.dk/vis-job/h1458262
Økonomimedarbejder/Controller,2024-04-08,Hjørring,https://www.jobindex.dk/vis-job/h1458197
"To koordinerende sagsbehandlere til Team Ydelse, Job og Ressourcer",2024-04-08,Thisted,https://www.jobindex.dk/vis-job/h1458182
Støt borgere i at finde deres rette hylde som jobtræner hos Team Virksomhedsservice,2024-04-08,Thisted,https://www.jobindex.dk/vis-job/h1458175
Økonomikonsulent,2024-04-08,Thisted,https://www.jobindex.dk/vis-job/h1458168
Kunderådgivere til studiegældsområdet i Frederikshavn,2024-04-08,Frederikshavn,https://www.jobindex.dk/vis-job/h1458160
Bliv privat lektiehjælper – et unikt studiejob eller deltidsjob,2024-04-08,unknown,https://www.jobindex.dk/vis-job/h1458003
Landinspektør / planlægger med VE-interesse,2024-04-08,Aalborg SV,https://www.jobindex.dk/vis-job/h1457617
Statsautoriseret revisor med lyst til nøglerolle og indflydelse,2024-04-08,Aalborg SV eller Hobro,https://www.jobindex.dk/vis-job/h1457616
Revisor,2024-04-08,Aalborg SV,https://www.jobindex.dk/vis-job/h1457614
"Økonomiassistenter, der brænder for tal og kundeservice",2024-04-08,Aalborg SV eller Hobro,https://www.jobindex.dk/vis-job/h1457612
Planteavlskonsulent – salgsafgrøder for store planteavlere,2024-04-08,Hobro,https://www.jobindex.dk/vis-job/h1457610
Erfaren journalist med indsigt eller interesse for landbruget,2024-04-08,Aalborg SV,https://www.jobindex.dk/vis-job/h1457607
Salgstrainees med speciale i byggematerialer eller værktøj,2024-04-08,unknown,https://www.jobindex.dk/vis-job/h1433450
Chaufførelever,2024-04-08,unknown,https://www.jobindex.dk/vis-job/h1433379
Lager- og logistikelever,2024-04-08,unknown,https://www.jobindex.dk/vis-job/h1433350
"Elev med speciale i glas, porcelæn og gaver",2024-04-08,unknown,https://www.jobindex.dk/vis-job/h1433325
Vi søger sygeplejersker og jordemødre i både Danmark og Norge,2024-04-07,unknown,https://www.jobindex.dk/vis-job/h1365788
Technical Documentation Specialist,2024-04-05,Mariager,https://www.jobindex.dk/vis-job/h1458135
Brobetjent til Jernbanebroen over Limfjorden,2024-04-05,Aalborg,https://www.jobindex.dk/vis-job/h1458134
Senior Business Controller (Aalborg),2024-04-05,unknown,https://www.jobindex.dk/vis-job/h1458125
Assisterende Investeringsspecialist,2024-04-05,Aars,https://www.jobindex.dk/vis-job/h1458116
Maskinarbejdere/industriteknikere med hurtig opstart,2024-04-05,"Aalborg Øst, Svenstrup J",https://www.jobindex.dk/vis-job/h1458082
Freelance-sælgere søges,2024-04-05,unknown,https://www.jobindex.dk/vis-job/h1458074
Lærer til drengegymnastik pr. 1/8 2024,2024-04-05,Haverslev,https://www.jobindex.dk/vis-job/h1458073
Salgssupportelev,2024-04-05,Thisted,https://www.jobindex.dk/vis-job/h1458050
Experienced Electronic Engineer – Sustainability,2024-04-05,"Skanderborg, Aalborg Øst, Esbjerg Ø, Sønderborg, København K",https://www.jobindex.dk/vis-job/h1458010
Vi søger håndfolk med å-vand i blodet til Nordjylland,2024-04-05,Svenstrup J,https://www.jobindex.dk/vis-job/h1457886
Regionschef til Louis Nielsen - Jylland,2024-04-05,Aalborg SØ,https://www.jobindex.dk/vis-job/h1457885
Har du natur og å-vand i blodet? Så kig her,2024-04-05,Aalestrup,https://www.jobindex.dk/vis-job/h1457873
15 timers stilling som juridisk rådgiver til Reden Aalborg,2024-04-05,Aalborg,https://www.jobindex.dk/vis-job/h1457867
UCN Bygningsdrift og Service søger administrativ servicecentermedarbejder til barselsvikariat,2024-04-05,Aalborg,https://www.jobindex.dk/vis-job/h1457841
Selvkørende PA med interesse for kommunikation,2024-04-05,Aalborg,https://www.jobindex.dk/vis-job/h1457782
Planlægger 15-20 timer/ugen,2024-04-05,Aalborg Øst,https://www.jobindex.dk/vis-job/h1457765
Senior Financial Controller,2024-04-05,Aalborg,https://www.jobindex.dk/vis-job/h1457716
Kom og bliv en del af vores stærke skadedyrsteam,2024-04-05,unknown,https://www.jobindex.dk/vis-job/h1457664
Det Blå Værested i Arden søger værestedsmedarbejder,2024-04-05,Arden,https://www.jobindex.dk/vis-job/h1457624
Salgskonsulent,2024-04-05,unknown,https://www.jobindex.dk/vis-job/h1457360
Hvidvaskmedarbejder til AML Transaktioner og Sanktioner,2024-04-05,Aalborg,https://www.jobindex.dk/vis-job/h1457287
Lastbilchauffør søges til tip-kørsel,2024-04-05,unknown,https://www.jobindex.dk/vis-job/h1457191
Mekaniker eller personvognsmontør søges hurtigst muligt,2024-04-05,Aalborg SV,https://www.jobindex.dk/vis-job/h1456930
Erhvervssupportere til Kundeservice i Aars,2024-04-05,unknown,https://www.jobindex.dk/vis-job/h1450615
Praktikplads for ingeniørstuderende,2024-04-05,Nørresundby,https://www.jobindex.dk/vis-job/h1450573
"Marketing Specialist til Malik, Aalborg",2024-04-05,Aalborg SV,https://www.jobindex.dk/vis-job/h1450513
Handelselev hos NORDEX FOOD,2024-04-05,Dronninglund,https://www.jobindex.dk/vis-job/h1450508
Software Developer - Enterprise products,2024-04-05,Nørresundby,https://www.jobindex.dk/vis-job/h1450363
Projekteringsledere med elektroteknisk baggrund,2024-04-05,"Fredericia, Aalborg eller København V",https://www.jobindex.dk/vis-job/h1450279
Tekniker til vedligehold på aftenhold med 4-dages arbejdsuge,2024-04-05,Mariager,https://www.jobindex.dk/vis-job/h1450038
Erfarne autoriserede psykologer søges til voksenområdet,2024-04-05,Aalborg,https://www.jobindex.dk/vis-job/h1450009
"Buschauffør, Ålborg",2024-04-05,unknown,https://www.jobindex.dk/vis-job/h1449793
"Mekaniker søges til MTH Biler, Toyota Nykøbing Mors",2024-04-05,unknown,https://www.jobindex.dk/vis-job/h1443202
Montører til branchens førende stålunivers,2024-04-05,Hobro,https://www.jobindex.dk/vis-job/h1442050
Tekniker/Mekaniker,2024-04-05,Fjerritslev,https://www.jobindex.dk/vis-job/h1458009
Social- og sundhedsassistentelever til hovedforløb hold SSA august 2024,2024-04-05,unknown,https://www.jobindex.dk/vis-job/h1457999
Servicetekniker søges til en virksomhed i rivende udvikling,2024-04-05,unknown,https://www.jobindex.dk/vis-job/h1457980
Værkstedchef til Volvo Truck Center Aalborg,2024-04-05,Aalborg,https://www.jobindex.dk/vis-job/h1457968
Rudemontør,2024-04-05,unknown,https://www.jobindex.dk/vis-job/h1457907
Customer Service Koordinator,2024-04-05,Løgstør,https://www.jobindex.dk/vis-job/h1457882
"Vil du syne biler og yde god kundeservice, så er det lige dig vi mangler",2024-04-05,Hjørring,https://www.jobindex.dk/vis-job/h1457786
Transfer Pricing Senior Manager/Director til BDO,2024-04-05,"København, Aalborg eller Aarhus",https://www.jobindex.dk/vis-job/h1457712
Site Planner - AKAFA Svenstrup J,2024-04-05,unknown,https://www.jobindex.dk/vis-job/h1457705
Konsulent til salg og rådgivning af tekniske løsninger,2024-04-05,unknown,https://www.jobindex.dk/vis-job/h1457686
Construction Project Manager,2024-04-05,unknown,https://www.jobindex.dk/vis-job/h1457663
Er du DS Smiths nye SAP Application Specialist?,2024-04-05,"Vejle, Grenaa, Taulov",https://www.jobindex.dk/vis-job/h1455836
Konsulent til Analyse og Procesafdelingen,2024-04-04,Aalborg,https://www.jobindex.dk/vis-job/h1457605
Repairtekniker,2024-04-04,unknown,https://www.jobindex.dk/vis-job/h1457573
Økonomichef med flair for IT,2024-04-04,Mariager,https://www.jobindex.dk/vis-job/h1457506
Sælger - He­alt­hca­re,2024-04-04,unknown,https://www.jobindex.dk/vis-job/h1457497
Robotsvejseoperatør til stort robotcenter,2024-04-04,Aalestrup,https://www.jobindex.dk/vis-job/h1457359
3 studentermedhjælpere til arbejde med geografiske data,2024-04-04,Nørresundby,https://www.jobindex.dk/vis-job/h1457357
Produktionsplanlægger søges til global markedsleder med produktionsfaciliteter,2024-04-04,Nørresundby,https://www.jobindex.dk/vis-job/h1457337
Mechanical Engineer til BILA End of Line,2024-04-04,Randers SV eller Mariager,https://www.jobindex.dk/vis-job/h1457321
Blå Kors Rold Skov søger socialfaglig medarbejder,2024-04-04,Arden,https://www.jobindex.dk/vis-job/h1457286
Teknisk designer med kendskab til AutoCad (Plant),2024-04-04,Aalborg Øst,https://www.jobindex.dk/vis-job/h1450163
Industritekniker med et skarpt blik for detaljer søges,2024-04-04,Støvring,https://www.jobindex.dk/vis-job/h1449951
Quality Engineer,2024-04-04,Nørresundby,https://www.jobindex.dk/vis-job/h1449945
HR professional with strong HR legal capabilities,2024-04-04,Nørresundby,https://www.jobindex.dk/vis-job/h1449929
Project Manager - Real Estate,2024-04-04,Aalborg Øst,https://www.jobindex.dk/vis-job/h1449785
"Product Marketer, Marketing",2024-04-04,Aalborg,https://www.jobindex.dk/vis-job/h1449509
Salg af servicekontrakter,2024-04-04,unknown,https://www.jobindex.dk/vis-job/h1440424
Resultatorienteret sælger med stort drive,2024-04-04,Aalborg SV,https://www.jobindex.dk/vis-job/h1457588
Bliv Business Services & Outsourcing-praktikant hos BDO til 2025 – hele landet,2024-04-04,unknown,https://www.jobindex.dk/vis-job/h1457528
Salgskonsulenter på deltid til Telenors butikker,2024-04-04,unknown,https://www.jobindex.dk/vis-job/h1457527
Salgskonsulenter på fuldtid til Telenors butikker,2024-04-04,unknown,https://www.jobindex.dk/vis-job/h1457524
Bliv revisorpraktikant hos BDO til 2025 – hele landet,2024-04-04,unknown,https://www.jobindex.dk/vis-job/h1457516
Regnskabschef til Nordens største fragtplatform,2024-04-04,Nørresundby,https://www.jobindex.dk/vis-job/h1457496
Nattevagt til fast stilling i Møllehuset,2024-04-04,Thisted,https://www.jobindex.dk/vis-job/h1457469
Kommune Konsulenterne søger sagsbehandlervikarer til Kommunernes ydelsesafdelinger i hele landet,2024-04-04,unknown,https://www.jobindex.dk/vis-job/h1457431
Eventinstruktør og driftmedarbejder,2024-04-04,Aalborg,https://www.jobindex.dk/vis-job/h1457413
Vaccinatør til vores rejseklinik i Aalborg (32 timer pr. uge),2024-04-04,Aalborg,https://www.jobindex.dk/vis-job/h1457373
Butiksassistent under 18 år - Aalborg,2024-04-04,Aalborg,https://www.jobindex.dk/vis-job/h1457304
"Butikschef til Telia, Frederikshavn",2024-04-04,unknown,https://www.jobindex.dk/vis-job/h1457276
Landets bedste kollega søges,2024-04-04,"Herning, Aalborg, Aarhus, Viborg, Kolding, Odense, Roskilde, Næstved, Hillerød eller København",https://www.jobindex.dk/vis-job/h1343730
IT-supporter,2024-04-03,Frøstrup,https://www.jobindex.dk/vis-job/h1457248
Manager – kom og motiver vores udekørende el-teknikere i deres dagligdag,2024-04-03,unknown,https://www.jobindex.dk/vis-job/h1457245
Market Analyst - Marine,2024-04-03,Nørresundby,https://www.jobindex.dk/vis-job/h1457222
Udekørende serviceelektriker til Wennstroms el-division,2024-04-03,unknown,https://www.jobindex.dk/vis-job/h1457204
Technical Specialist til internationale idriftsættelsesopgaver,2024-04-03,Aalborg Øst,https://www.jobindex.dk/vis-job/h1457179
"Salgsassistent - der udover at gå på arbejde, kan lide at lege og spille brætspil!",2024-04-03,Aalborg,https://www.jobindex.dk/vis-job/h1457158
GENOPSLAG - Pædagog Fritidsklub/Støtte-kontaktperson,2024-04-03,unknown,https://www.jobindex.dk/vis-job/h1457061
Delikatesseassistent,2024-04-03,Hobro,https://www.jobindex.dk/vis-job/h1457032
"Økonomisk Konsulent med fokus på budget, styring og analyse",2024-04-03,Brønderslev,https://www.jobindex.dk/vis-job/h1457019
Formand,2024-04-03,Hobro,https://www.jobindex.dk/vis-job/h1456993
Selvstændig mekaniker søges til branchens bedste arbejdsplads i Aalborg,2024-04-03,Aalborg Øst,https://www.jobindex.dk/vis-job/h1456893
Erfaren supervisor med sygeplejefaglig baggrund,2024-04-03,unknown,https://www.jobindex.dk/vis-job/h1456882
Ex­pe­ri­en­ced agile QA Engineer,2024-04-03,Vejle or Aalborg SV,https://www.jobindex.dk/vis-job/h1449539
Software Developer - Protocol,2024-04-03,Nørresundby,https://www.jobindex.dk/vis-job/h1449414
Konstruktør – tegn linjerne til avancerede multihead-vægte,2024-04-03,Hjørring,https://www.jobindex.dk/vis-job/h1444316
Mekaniker eller autotekniker søges til Aalborg Syd,2024-04-03,unknown,https://www.jobindex.dk/vis-job/h1440426
Underviser til kompositfaget,2024-04-03,Aalborg,https://www.jobindex.dk/vis-job/h1457246
First Line Supporter,2024-04-03,"Vejen, Brøndby, Aalborg eller Aarhus N",https://www.jobindex.dk/vis-job/h1457171
"Souschef, Dagli'Brugsen Frøstrup",2024-04-03,Frøstrup,https://www.jobindex.dk/vis-job/h1457054
Køletekniker,2024-04-03,Frederikshavn,https://www.jobindex.dk/vis-job/h1457005
Bliv salgselev i Tøjeksperten eller Wagner,2024-04-03,unknown,https://www.jobindex.dk/vis-job/h1456919
Smed,2024-04-03,Nordjylland,https://www.jobindex.dk/vis-job/h1456891
Rengøringsmedarbejder/Cleaning Assistant,2024-04-03,unknown,https://www.jobindex.dk/vis-job/h1456877
Elev,2024-04-03,unknown,https://www.jobindex.dk/vis-job/h1456524
Ejendomsinspektør med variabel portefølje til ATP Ejendomme,2024-04-03,unknown,https://www.jobindex.dk/vis-job/h1455437
Underviser til vækstvirksomhed indenfor trivsel og udvikling,2024-04-02,unknown,https://www.jobindex.dk/vis-job/h1456875
Vi søger bager til Surdejsbageren i hjertet af Aalborg,2024-04-02,unknown,https://www.jobindex.dk/vis-job/h1456847
Vi søger Kreativ Konditor til Surdejsbageren i hjertet af Aalborg,2024-04-02,unknown,https://www.jobindex.dk/vis-job/h1456838
"Teknisk designer, teknisk tegner eller maskiningeniør",2024-04-02,Aalborg Øst,https://www.jobindex.dk/vis-job/h1456784
Produktionsmedarbejder,2024-04-02,Hadsund,https://www.jobindex.dk/vis-job/h1456764
Kok til kantine i Aalborg Ø,2024-04-02,unknown,https://www.jobindex.dk/vis-job/h1456723
Revisor,2024-04-02,"Hadsund, Randers SØ, Tilst, Grenaa",https://www.jobindex.dk/vis-job/h1456715
Produktionsmedarbejder,2024-04-02,Hurup,https://www.jobindex.dk/vis-job/h1456691
Sommerassistance hos Imerco Skagen,2024-04-02,Skagen,https://www.jobindex.dk/vis-job/h1456678
Administrerende direktør,2024-04-02,Nykøbing M,https://www.jobindex.dk/vis-job/h1456648
Udekørende servicetekniker til entreprenørmaskiner,2024-04-02,unknown,https://www.jobindex.dk/vis-job/h1456551
Elektrikere til Caverions Højspændingsforretning,2024-04-02,unknown,https://www.jobindex.dk/vis-job/h1456547
Projektleder,2024-04-02,Nykøbing Mors,https://www.jobindex.dk/vis-job/h1456520
Multi-country Rotational Program: European Sales Account Manager for the Data Center Business,2024-04-02,"Ballerup, Kolding, Aarhus V, Ringsted, Odense SØ",https://www.jobindex.dk/vis-job/h1456494
Account Manager,2024-04-02,unknown,https://www.jobindex.dk/vis-job/h1456410
Fagansvarlig til bredde-dommerområdet,2024-04-02,"Brøndby, Odense V, Hobro, Ikast",https://www.jobindex.dk/vis-job/h1455023
Lokomotivførerelever med start i september 2024,2024-04-02,Aalborg,https://www.jobindex.dk/vis-job/h1454923
"Vi søger dygtige, stabile og ansvarlige elektrikere til servicering af erhverv og detail",2024-04-02,unknown,https://www.jobindex.dk/vis-job/h1452999
Dygtig og struktureret sagskoordinator,2024-04-02,unknown,https://www.jobindex.dk/vis-job/h1452261
Group Lead,2024-04-02,Aalborg Øst,https://www.jobindex.dk/vis-job/h1449269
Speciallæge i psykiatri – vil du være en del af et højt kvalificeret team?,2024-04-02,"Høje-Taastrup, Kongens Lyngby, Ringsted, Kolding, Silkeborg, Aarhus eller Aalborg",https://www.jobindex.dk/vis-job/h1449115
Kørende Salgskonsulent til salg af Tryghed – Midt- og Nordjylland,2024-04-02,unknown,https://www.jobindex.dk/vis-job/h1448868
Bliv driftskonsulent og supporter,2024-04-02,Aalborg,https://www.jobindex.dk/vis-job/h1447515
Kalkulatør til Jord i Jylland,2024-04-02,"Risskov, Aalborg eller Fredericia",https://www.jobindex.dk/vis-job/h1440447
Selvstændig arbejdsmiljøkonsulent søges til infrastruktur-projekter på Fyn og i Jylland,2024-04-02,unknown,https://www.jobindex.dk/vis-job/h1439809
Entrepriseleder,2024-04-02,unknown,https://www.jobindex.dk/vis-job/h1439123
Socialrådgivere og socialformidlere med flere års erfaring søges til vikariater i hele Danmark,2024-04-02,unknown,https://www.jobindex.dk/vis-job/h1427411
Teknisk Teamlead med personaleansvar,2024-04-02,Aalborg,https://www.jobindex.dk/vis-job/h1456824
Assistance søger både dygtigt faglært og dedikeret ufaglært køkkenpersonale til vikariater i Nordjylland,2024-04-02,unknown,https://www.jobindex.dk/vis-job/h1456757
Backend Developer,2024-04-02,Aalborg,https://www.jobindex.dk/vis-job/h1456726
Sælger,2024-04-02,Sæby,https://www.jobindex.dk/vis-job/h1456666
SSH-elever til uddannelsesforløb SSH GF 2 august 2024 og SSH Februar 2025,2024-04-02,unknown,https://www.jobindex.dk/vis-job/h1456601
SSA-elever i sammenhængende forløb GF2 juli og Hovedforløb SSA December 2024,2024-04-02,unknown,https://www.jobindex.dk/vis-job/h1456597
Social- og sundhedshjælperelever til hovedforløb SSH hold August 2024,2024-04-02,unknown,https://www.jobindex.dk/vis-job/h1456591
Rengøringsafløser,2024-04-02,Hirtshals,https://www.jobindex.dk/vis-job/h1456588
Medarbejder Fun & Entertainment,2024-04-02,Ranum,https://www.jobindex.dk/vis-job/h1456572
Souschef,2024-04-02,Ranum,https://www.jobindex.dk/vis-job/h1456571
Deltids servicepersonale,2024-04-02,Ranum,https://www.jobindex.dk/vis-job/h1456570
Biologoverassistent / Fiskeritekniker for til-søs indsamlinger - DTU Aqua,2024-04-02,Hirtshals,https://www.jobindex.dk/vis-job/h1456566
Servicetekniker Jylland,2024-04-02,unknown,https://www.jobindex.dk/vis-job/h1456552
Medarbejder,2024-04-02,Ranum,https://www.jobindex.dk/vis-job/h1456545
Opvasker,2024-04-02,Ranum,https://www.jobindex.dk/vis-job/h1456536
25 timers stilling F&B,2024-04-02,Ranum,https://www.jobindex.dk/vis-job/h1456534
Assistant store manager Aalborg,2024-04-02,Aalborg SV,https://www.jobindex.dk/vis-job/h1456457
Bliv privat lektiehjælper – et unikt studiejob eller deltidsjob,2024-04-02,unknown,https://www.jobindex.dk/vis-job/h1455858
Kundemedarbejder til Tårs,2024-04-01,Tårs,https://www.jobindex.dk/vis-job/h1448507
Projektleder til Middle Office,2024-04-01,unknown,https://www.jobindex.dk/vis-job/h1448489
Lærlinge og elever 2024,2024-04-01,unknown,https://www.jobindex.dk/vis-job/h1448379
Privatkunderådgiver til Brovst,2024-04-01,unknown,https://www.jobindex.dk/vis-job/h1439986
Bliv rådgiver hos Indkøbsnetværket,2024-03-30,unknown,https://www.jobindex.dk/vis-job/h1448276
En karriere med muligheder - bliv revisortrainee hos BDO med opstart september 2024!,2024-03-30,unknown,https://www.jobindex.dk/vis-job/h1456426
Start din karriere som trainee inden for Business & Outsourcing - september 2024,2024-03-30,unknown,https://www.jobindex.dk/vis-job/h1456420
Vil du være vores sommerferiehelt?,2024-03-30,Thisted,https://www.jobindex.dk/vis-job/h1439201
Mechanical Engineer,2024-03-29,Arden,https://www.jobindex.dk/vis-job/h1448244
Superintendent Service Engineer,2024-03-29,Aalborg Øst,https://www.jobindex.dk/vis-job/h1447925
NetScaler Specialist – bliv en del af itm8,2024-03-29,"Herning, Viby J, København Ø, Kolding, Aalborg SØ",https://www.jobindex.dk/vis-job/h1439849
"Application Manager - Centrifugal pumps, Industry & utility",2024-03-29,Nørresundby,https://www.jobindex.dk/vis-job/h1439463
"Application Manager - ROTAN Internal Gear Pumps, Industry & utility",2024-03-29,Nørresundby,https://www.jobindex.dk/vis-job/h1439447
