Title,Published Date,Location,URL
Bliv privat lektiehjælper – et unikt studiejob eller deltidsjob,2024-03-18,unknown,https://www.jobindex.dk/vis-job/h1452673
Operational Technology (OT) Security Specialist,2024-03-15,Hobro,https://www.jobindex.dk/vis-job/h1452761
Senior Specialist Clinical Safety and Pharmacovigilance (CSPV),2024-03-15,unknown,https://www.jobindex.dk/vis-job/h1452716
Stærk på ledelse og driftsopfølgning?,2024-03-15,Aalborg,https://www.jobindex.dk/vis-job/h1452681
Regnskabsassistent søges,2024-03-15,Svenstrup J,https://www.jobindex.dk/vis-job/h1452552
Business Solution Manager til Skandinaviens største fragtportal,2024-03-15,Nørresundby,https://www.jobindex.dk/vis-job/h1452453
Arbejdsmand til weekendhold,2024-03-15,Aalborg Ø,https://www.jobindex.dk/vis-job/h1452446
Allround kontorelev,2024-03-15,Hjallerup,https://www.jobindex.dk/vis-job/h1452426
Planning Coordinator til vækstvirksomhed,2024-03-15,Nørresundby,https://www.jobindex.dk/vis-job/h1452414
Production Planner med flair for IT,2024-03-15,Nørresundby,https://www.jobindex.dk/vis-job/h1452410
"Maritim Data Specialist søges til ""Prøvetanken""",2024-03-15,Hirtshals,https://www.jobindex.dk/vis-job/h1452389
Erhvervssupporter til Support Erhverv Østvendsyssel,2024-03-15,"Frederikshavn, Sæby, Skagen eller Dronninglund",https://www.jobindex.dk/vis-job/h1452350
Teknisk assistent med interesse for den almene boligsektor,2024-03-15,Aalborg,https://www.jobindex.dk/vis-job/h1452301
Global Naval Sales and Business Intelligence Manager at DESMI Defence & Fuel,2024-03-15,Nørresundby,https://www.jobindex.dk/vis-job/h1452276
Brænder du for udvikling af produkter? Få et spændende job som kompositingeniør,2024-03-15,Frederikshavn,https://www.jobindex.dk/vis-job/h1452238
Business Controller salg og marketing,2024-03-15,Hirtshals,https://www.jobindex.dk/vis-job/h1444419
Teknisk nørderi på farten: Miljøbevidst måletekniker med interesse for luftemissioner,2024-03-15,unknown,https://www.jobindex.dk/vis-job/h1441665
Salgselev hos MTH biler – Toyota Hadsund,2024-03-15,unknown,https://www.jobindex.dk/vis-job/h1437514
Automationsingeniører,2024-03-15,"Silkeborg, Hillerød, Odense, Aarhus, Esbjerg og Aalborg",https://www.jobindex.dk/vis-job/h1435623
BI-udvikler,2024-03-15,Hobro,https://www.jobindex.dk/vis-job/h1435573
Quality Specialist – Nordjylland eller Sjælland,2024-03-15,unknown,https://www.jobindex.dk/vis-job/h1452651
"Mechanical Engineer, rørsystemer – Energi & Proces, Pharma og Grøn Omstilling",2024-03-15,"Ballerup, Vejle eller Aalborg",https://www.jobindex.dk/vis-job/h1452603
"Automationsingeniør/PLC-programmør – Energi, Proces, Pharma og Grøn omstilling",2024-03-15,"Ballerup, Vejle eller Aalborg",https://www.jobindex.dk/vis-job/h1452600
"El-ingeniør – Energi, Proces, Pharma og Grøn omstilling",2024-03-15,"Ballerup, Vejle eller Aalborg",https://www.jobindex.dk/vis-job/h1452598
"Projektingeniør – Energi & Proces, Pharma og Grøn Omstilling",2024-03-15,"Ballerup, Vejle eller Aalborg",https://www.jobindex.dk/vis-job/h1452590
"Tekniske projektledere – Energi, Proces, Pharma og Grøn omstilling",2024-03-15,"Ballerup, Vejle eller Aalborg",https://www.jobindex.dk/vis-job/h1452586
Salgselev i ILVA - vi har fokus på DIN udvikling,2024-03-15,Frederikshavn,https://www.jobindex.dk/vis-job/h1452509
Hydrema Group i Støvring søger assistent til produktsupport,2024-03-15,Støvring,https://www.jobindex.dk/vis-job/h1452491
Lyngsoe Systems søger erfaren Softwareudvikler - Bliv en del af vores dynamiske team!,2024-03-15,Aars,https://www.jobindex.dk/vis-job/h1452480
Lønkonsulent til HR Løn,2024-03-15,Aalborg,https://www.jobindex.dk/vis-job/h1452440
Produktionsleder med et godt lederskab til daghold,2024-03-15,Løgstør,https://www.jobindex.dk/vis-job/h1452416
Udekørende servicemontør til Nordjylland,2024-03-15,unknown,https://www.jobindex.dk/vis-job/h1452377
Process Consultant med ekspertise i procesforbedring og facilitering (barselsvikariat),2024-03-15,Aalborg,https://www.jobindex.dk/vis-job/h1452342
Personalekonsulent til Personaleteamet - barselsvikariat,2024-03-15,Thisted,https://www.jobindex.dk/vis-job/h1452321
Pædagog til Bofællesskabet Auktionsvej,2024-03-15,Hurup Thy,https://www.jobindex.dk/vis-job/h1452309
Erfaren økonomi- og HR-konsulent,2024-03-15,unknown,https://www.jobindex.dk/vis-job/h1452303
Elev til indkøbsfunktion,2024-03-15,Svenstrup,https://www.jobindex.dk/vis-job/h1451712
Executive Assistant/mødebooker,2024-03-14,"Skodsborg, Vejle, Svenstrup J",https://www.jobindex.dk/vis-job/h1452266
Kørende tekniker til Jylland,2024-03-14,unknown,https://www.jobindex.dk/vis-job/h1452183
Projektlederassistent til hoved- og totalentreprenør i vækst,2024-03-14,unknown,https://www.jobindex.dk/vis-job/h1452143
Tysktalende teknisk projektleder,2024-03-14,Nørresundby,https://www.jobindex.dk/vis-job/h1452132
Surveyor,2024-03-14,Aalborg Øst,https://www.jobindex.dk/vis-job/h1452104
Operationel CEO,2024-03-14,Aalborg SV,https://www.jobindex.dk/vis-job/h1452103
Protocol Stack Developer - for 5G Space Development,2024-03-14,Nørresundby,https://www.jobindex.dk/vis-job/h1452055
Senior Softwareudvikler til globale lufthavnsprojekter - Aarhus/Aalborg,2024-03-14,Aarhus/Aalborg,https://www.jobindex.dk/vis-job/h1451954
Site Manager – vær med til at gøre den grønne omstilling mulig,2024-03-14,unknown,https://www.jobindex.dk/vis-job/h1451907
Frisk og serviceminded piccoline/piccolo til reception,2024-03-14,Hobro,https://www.jobindex.dk/vis-job/h1451880
Erfaren lønbogholder til økonomiafdelingen,2024-03-14,Hobro,https://www.jobindex.dk/vis-job/h1451879
Policemedarbejder/skadebehandler,2024-03-14,Hjørring,https://www.jobindex.dk/vis-job/h1451713
Kickstart din (klima)karriere. Projektleder søges,2024-03-14,Løgstør,https://www.jobindex.dk/vis-job/h1451519
Klar til at tage næste skridt i din karriere? Bliv projektleder inden for klimatilpasningsprojekter!,2024-03-14,Løgstør,https://www.jobindex.dk/vis-job/h1451518
Vi søger en data-haj. Vil du gøre en forskel gennem analyse og klimatilpasning?,2024-03-14,Løgstør,https://www.jobindex.dk/vis-job/h1451516
Privatkunderådgiver til Aalborg – Budolfi Plads,2024-03-14,Aalborg,https://www.jobindex.dk/vis-job/h1444102
STRUKTØRER TIL NCO BYG A/S,2024-03-14,unknown,https://www.jobindex.dk/vis-job/h1443653
Konstruktionsingeniør søges,2024-03-14,Hjørring,https://www.jobindex.dk/vis-job/h1443473
Miljøkoordinator,2024-03-14,Thisted,https://www.jobindex.dk/vis-job/h1442494
Maskinmester,2024-03-14,Thisted,https://www.jobindex.dk/vis-job/h1442489
Økonomimedarbejder,2024-03-14,Thisted,https://www.jobindex.dk/vis-job/h1442485
Indkøber/koordinator til teknisk afdeling,2024-03-14,Thisted,https://www.jobindex.dk/vis-job/h1442483
Teknisk supporter,2024-03-14,Støvring,https://www.jobindex.dk/vis-job/h1439317
Butiksmedarbejdere,2024-03-14,unknown,https://www.jobindex.dk/vis-job/h1439268
For our Scandinavian subsidiary we are looking for the Jr. Country Manager Denmark (m/f/d),2024-03-14,unknown,https://www.jobindex.dk/vis-job/h1452268
"Timeansat til Magasin, Aalborg",2024-03-14,unknown,https://www.jobindex.dk/vis-job/h1452256
"Timeansat til Metropol, Hjørring",2024-03-14,unknown,https://www.jobindex.dk/vis-job/h1452252
"Driftsleder med fokus på lederskab, bæredygtighed og miljø",2024-03-14,Skagen,https://www.jobindex.dk/vis-job/h1452126
E-Commerce Lead Specialist Web Merchandising,2024-03-14,Aalborg,https://www.jobindex.dk/vis-job/h1452083
"Udekørende servicetekniker til Danmarks største leverandør af trucks og lagerløsninger, Nordjylland",2024-03-14,unknown,https://www.jobindex.dk/vis-job/h1452036
"Souschef, 365discount Søndergade Frederikshavn",2024-03-14,Frederikshavn,https://www.jobindex.dk/vis-job/h1451999
"Stop op, der er nyt job på tanken – bliv salgsassistent på én af vores Q8-stationer",2024-03-14,unknown,https://www.jobindex.dk/vis-job/h1443771
"Et vellønnet, meningsfyldt og fleksibelt job",2024-03-14,"Aarhus, Lyngby, Aalborg, København K og København N",https://www.jobindex.dk/vis-job/h1395383
Har du erfaring med installation af brandalarm- og varslingsanlæg? Og kunne du tænke dig at blive uddannet til inspektør af brandalarm- og varslingsanlæg?,2024-03-13,unknown,https://www.jobindex.dk/vis-job/h1451839
Jr. Country Manager Denmark (m/f/d),2024-03-13,unknown,https://www.jobindex.dk/vis-job/h1451836
Planlægger produktion nathold,2024-03-13,Aars,https://www.jobindex.dk/vis-job/h1451763
"Køkkenfagligt Personale Søges til Aalborg, Frederikshavn, Hjørring og Omegn",2024-03-13,unknown,https://www.jobindex.dk/vis-job/h1451726
Danmarks førende dronevirksomhed søger Embedded Software Ingeniør,2024-03-13,Støvring,https://www.jobindex.dk/vis-job/h1451654
Administrationsmedarbejder med flair for økonomi,2024-03-13,Nørresundby,https://www.jobindex.dk/vis-job/h1451637
Emission Specialist,2024-03-13,Frederikshavn,https://www.jobindex.dk/vis-job/h1450873
Afdelingsdirektør til Vejgaard,2024-03-13,unknown,https://www.jobindex.dk/vis-job/h1443743
Smed/opbygger,2024-03-13,Støvring,https://www.jobindex.dk/vis-job/h1443234
Håndværkerbranchens ERP-system søger kundeminded medarbejder med regnskabserfaring,2024-03-13,Aalborg SV,https://www.jobindex.dk/vis-job/h1434496
"Studiejob - industri, salg og produktion der former energiproduktionen til fremtidens samfund",2024-03-13,Storvorde,https://www.jobindex.dk/vis-job/h1451891
We are hiring a skilled Sales Manager,2024-03-13,"Esbjerg (DK), Flensburg (DE)",https://www.jobindex.dk/vis-job/h1451859
Grundfos søger udekørende servicetekniker til Jylland og Fyn,2024-03-13,unknown,https://www.jobindex.dk/vis-job/h1451725
Entrepriseleder,2024-03-13,Aalborg,https://www.jobindex.dk/vis-job/h1451668
Passionerede individer til privatundervisning,2024-03-13,unknown,https://www.jobindex.dk/vis-job/h1451581
Hørespecialist til Audika i Thisted,2024-03-13,unknown,https://www.jobindex.dk/vis-job/h1451556
Business Developer He­alt­hca­re,2024-03-12,unknown,https://www.jobindex.dk/vis-job/h1451464
Logistics employee,2024-03-12,Hirtshals,https://www.jobindex.dk/vis-job/h1451439
Indkøbselev,2024-03-12,Hjørring,https://www.jobindex.dk/vis-job/h1451364
Graduate - Forretningsanalyser og digitaliseringsprojekter,2024-03-12,Aalborg,https://www.jobindex.dk/vis-job/h1451338
Aftersales og servicekoordinator – barselsvikariat,2024-03-12,Aalborg Øst,https://www.jobindex.dk/vis-job/h1451337
Økonomichef,2024-03-12,Sindal,https://www.jobindex.dk/vis-job/h1451288
"Chauffør til lastbil – kør med os, vejen er din",2024-03-12,Nørresundby,https://www.jobindex.dk/vis-job/h1451236
Mekaniker – Stiholt Erhvervsbiler,2024-03-12,Aalborg Øst,https://www.jobindex.dk/vis-job/h1451150
Danmarks førende dronevirksomhed søger Mekanikingeniør,2024-03-12,Støvring,https://www.jobindex.dk/vis-job/h1442613
Norsktalende Kundeservice- og Markedsføringsassistent,2024-03-12,Terndrup,https://www.jobindex.dk/vis-job/h1451473
Deltids restaurant -& servicepersonale,2024-03-12,Ranum,https://www.jobindex.dk/vis-job/h1451263
Personvognsmekaniker/servicetekniker – Aalborg,2024-03-12,Svenstrup J,https://www.jobindex.dk/vis-job/h1451127
"Facility Manager til ikonisk kultur-, konference- og sportscenter",2024-03-12,Frederikshavn,https://www.jobindex.dk/vis-job/h1451103
Customer Experience Manager – Elgiganten Aalborg,2024-03-12,Aalborg,https://www.jobindex.dk/vis-job/h1451009
Handelselev med speciale i indkøb - Aalborg,2024-03-11,unknown,https://www.jobindex.dk/vis-job/h1432408
Sales Executive - salg til store virksomheder i Danmark,2024-03-11,Hedensted,https://www.jobindex.dk/vis-job/h1450841
Maintenance Manager,2024-03-01,Hobro,https://www.jobindex.dk/vis-job/h1448078
Salgsdirektør,2024-02-28,unknown,https://www.jobindex.dk/vis-job/h1447195
Plant Manager,2024-02-21,Hobro,https://www.jobindex.dk/vis-job/h1445123
Salgschef,2024-02-20,unknown,https://www.jobindex.dk/vis-job/h1444955
Praktik i El-konstruktion,2024-02-13,Nykøbing Mors,https://www.jobindex.dk/vis-job/h1443254
"Sognepræst (50%) i Frøslev Pastorat, Morsø Provsti og Ressourcepræst (50%) for Kirke på Landet og i Sommerlandet (KPL) i Aalb...",2024-04-09,Aalborg,https://www.jobindex.dk/vis-job/r12413528
"Sognepræst i Sennels-Hillerslev-Kåstrup Pastorat, Thisted Provsti, Aalborg Stift",2024-04-09,Aalborg,https://www.jobindex.dk/vis-job/r12413529
Vil du være vores nye nattevagt på Mosbjerghus?,2024-04-09,Hjørring,https://www.jobindex.dk/vis-job/r12413775
Er du uddannet tømrer og på udkig efter nye udfordringer? 𝘀𝗮̊ 𝗲𝗿 𝗱𝗲𝘁 𝗺𝗮̊𝘀𝗸𝗲 𝗱𝗶𝗴 𝘃𝗶 𝘀ø𝗴𝗲𝗿!,2024-04-09,Svenstrup J,https://www.jobindex.dk/vis-job/r12413605
Er DU vores nye kollega på Samværs og aktivitetscenter Hjortdal?,2024-04-09,Aabybro,https://www.jobindex.dk/vis-job/r12413604
Chauffør til Kørsel med Industrigasser,2024-04-09,Nykøbing M,https://www.jobindex.dk/vis-job/r12413653
Kok til kinesisk restaurant søges! / Chef for Chinese restaurant wanted!,2024-04-09,Aalborg,https://www.jobindex.dk/vis-job/r12413654
NK Care / BPA Service søger handicaphjælper til sygevikariat hos rygmarvsskadet kvinde,2024-04-09,Hjørring,https://www.jobindex.dk/vis-job/r12413684
Mekaniker til attraktiv 4 dages arbejdsuge !!!,2024-04-09,Nørager,https://www.jobindex.dk/vis-job/r12413593
"Sygeplejersker søges til Neonatalafsnit 12 og 13, Aalborg Universitetshospital",2024-04-09,Aalborg,https://www.jobindex.dk/vis-job/r12413614
Kasseassistent - Hjørring,2024-04-09,Hjørring,https://www.jobindex.dk/vis-job/r12413541
Kasseassistent under 18 år - Hjørring,2024-04-09,Hjørring,https://www.jobindex.dk/vis-job/r12413540
Salgsassistentelev til Food - Aalborg,2024-04-09,Aalborg,https://www.jobindex.dk/vis-job/r12413549
"Rengøringsassistent til Skagen - Arbejdssted Bh Trindelvej, Ungdomshuset samt Skagen støttecenter",2024-04-08,Frederikshavn,https://www.jobindex.dk/vis-job/r12412358
Sygeplejerske til Frederikshavn Kommunes Sundhedscentre,2024-04-08,Frederikshavn,https://www.jobindex.dk/vis-job/r12412359
"1 bostøttemedarbejder til Center for socialpsykiatri og Autisme - Team A, Nørresundby",2024-04-08,Nørresundby,https://www.jobindex.dk/vis-job/r12412292
Assisterende plejehjemsleder til plejehjemmet Markusgården,2024-04-08,Aalborg,https://www.jobindex.dk/vis-job/r12412295
"Fagligt ambitiøse pædagoger, ergoterapeuter, fysioterapeuter eller social- og sundhedsassistenter søges til Attruphøj",2024-04-08,Vodskov,https://www.jobindex.dk/vis-job/r12412294
Jobhuset søger to faglige koordinatorer til området for forsikrede ledige,2024-04-08,Aalborg,https://www.jobindex.dk/vis-job/r12412293
Køkkenassistent Troldehuset,2024-04-08,Aalborg,https://www.jobindex.dk/vis-job/r12412288
Omsorgs- og pædagogmedhjælpere søges til ferievikariater til Botilbud i Nørresundby,2024-04-08,Nørresundby,https://www.jobindex.dk/vis-job/r12412291
Social- og sundhedsassistent/hjælper til nattevagt - Specialplejehjem Tornhøjhaven,2024-04-08,Aalborg Øst,https://www.jobindex.dk/vis-job/r12412289
Tilsynsassistent i Nord/Øst,2024-04-08,Aalborg,https://www.jobindex.dk/vis-job/r12412290
Logistikkoordinator til Kundeservice i Farre,2024-04-08,"Give, Aars",https://www.jobindex.dk/vis-job/r12412344
Assisterende Dokleder til Forsvarets Challenger fly på Flyvestation Aalborg,2024-04-08,Vadum,https://www.jobindex.dk/vis-job/r12412231
Automatiktekniker el.lign. som våbentekniker til Fregatten ABSALON (genopslag),2024-04-08,Frederikshavn,https://www.jobindex.dk/vis-job/r12412233
Leder til Aircraft Maintenance Squadron ved Air Transport Wing i Aalborg,2024-04-08,Vadum,https://www.jobindex.dk/vis-job/r12412255
"Medarbejder til administration af søværnets værnepligtige søges til Center for Maritim Uddannelse og Skibssikkerhed, Bangsbo",2024-04-08,Frederikshavn,https://www.jobindex.dk/vis-job/r12412257
Militær Bilsagkyndig til Forsvarets Bilsyn ved Trænregimentet,2024-04-08,Nørresundby,https://www.jobindex.dk/vis-job/r12412262
Næstkommanderende i én Transportdeling ved 4. Transportkompagni 1. Logistikbataljon,2024-04-08,Nørresundby,https://www.jobindex.dk/vis-job/r12412265
Sektionsfører i Middeltung Transportdeling ved 4. Transportkompagni 1. Logistikbataljon,2024-04-08,Nørresundby,https://www.jobindex.dk/vis-job/r12412271
Sikrings- og boardingofficer (SBO) søges til fregatten ABSALON,2024-04-08,Frederikshavn,https://www.jobindex.dk/vis-job/r12412272
Stabsbefalingsmand (CBRN) ved Stabsdelingen i 1. Logistikbataljon,2024-04-08,Nørresundby,https://www.jobindex.dk/vis-job/r12412273
"Taktisk kommunikationsbefalingsmand ved 4. Transportkompagni, 1. Logistikbataljon",2024-04-08,Nørresundby,https://www.jobindex.dk/vis-job/r12412276
Teamleder til Aircraft Maintenance Squadron ved Air Transport Wing i Aalborg,2024-04-08,Vadum,https://www.jobindex.dk/vis-job/r12412277
Transportbefalingsmand til 4. Transportkompagni ved 1. Logistikbataljon,2024-04-08,Nørresundby,https://www.jobindex.dk/vis-job/r12412278
Vagtholdsleder til Vagt- og Bevogtningselementet ved Flådestation Frederikshavn,2024-04-08,Frederikshavn,https://www.jobindex.dk/vis-job/r12412282
Børnehaveklasseleder til Karensmindeskolen,2024-04-08,Støvring,https://www.jobindex.dk/vis-job/r12412317
Praktikant til Planafdelingen,2024-04-08,Støvring,https://www.jobindex.dk/vis-job/r12412318
Advokatsekretær søges til kunde i Aalborg,2024-04-08,Aalborg SV,https://www.jobindex.dk/vis-job/r12412286
elektriker,2024-04-08,Løgstør,https://www.jobindex.dk/vis-job/r12412225
maskinarbejder,2024-04-08,Løgstør,https://www.jobindex.dk/vis-job/r12412222
Anlægsgartner søges,2024-04-08,Aalborg,https://www.jobindex.dk/vis-job/r12411807
Faglærer til rengøringsområdet,2024-04-08,Aalborg,https://www.jobindex.dk/vis-job/r12411556
Industriteknikerlærling/Skibsmontørlærling,2024-04-08,Vodskov,https://www.jobindex.dk/vis-job/r12411458
Procesoperatør/specialarbejder til Aalborg Portland,2024-04-08,"USA, Aalborg",https://www.jobindex.dk/vis-job/r12413374
PhD Stipend in Online aging models of Lithium Batteries based on physical- aware AI,2024-04-08,Aalborg,https://www.jobindex.dk/vis-job/r12412744
PhD Stipends/Integrated Stipends in Deep Learning Based Acoustic Signal Processing for Hearing Assistive Devices,2024-04-08,Aalborg,https://www.jobindex.dk/vis-job/r12412745
Postdoc in Enhancing Circular Economy through Improved Construction Site Waste Management,2024-04-08,Aalborg,https://www.jobindex.dk/vis-job/r12412747
Postgraduat klinisk lektor eller ekstern lektor i Patologisk anatomi og cytologi,2024-04-08,Aalborg,https://www.jobindex.dk/vis-job/r12412746
Pædagogisk assistent i vuggestueafdelingen,2024-04-08,Aars,https://www.jobindex.dk/vis-job/r12411627
Salgsassistent Basic & More,2024-04-08,Aalborg SV,https://www.jobindex.dk/vis-job/r12412962
Pædagog til vuggestue,2024-04-08,Hjallerup,https://www.jobindex.dk/vis-job/r12412954
Tandlæge/cand.odont,2024-04-08,Brønderslev,https://www.jobindex.dk/vis-job/r12412135
Natportier afløser søges til Aalborg Airport Hotel,2024-04-08,Nørresundby,https://www.jobindex.dk/vis-job/r12411528
Kalder alle supersælgere! Circle K Brønderslev søger en sælger på 8 timer til deres team! Velegnet som studiejob,2024-04-08,Brønderslev,https://www.jobindex.dk/vis-job/r12411308
Freelance massør søges til 9200 Aalborg SV,2024-04-08,Aalborg SV,https://www.jobindex.dk/vis-job/r12412966
"CaterCorp søger dygtig, kreativ og kvalitetsbevidst kok",2024-04-08,Svenstrup J,https://www.jobindex.dk/vis-job/r12411980
Kalder alle supersælgere! Circle K søger en sælger på ca. 20 timer til motorvejs stationen ca. 20 km syd for Aalborg,2024-04-08,Suldrup,https://www.jobindex.dk/vis-job/r12411969
Kalder alle supersælgere! Circle K Thisted søger en sælger på ca. 10 timer om ugen,2024-04-08,Thisted,https://www.jobindex.dk/vis-job/r12411873
Marketingkoordinator med ansvar for cool contentproduktion- og planlægning,2024-04-08,Nørresundby,https://www.jobindex.dk/vis-job/r12411772
Lastbilmekaniker søges til Mercedes-Benz i Aars,2024-04-08,Aars,https://www.jobindex.dk/vis-job/r12413140
Team Lead for IT Operation Center,2024-04-08,Aars,https://www.jobindex.dk/vis-job/r12413384
Personlig hjælpere søges til helt nyt hjælper team – Nykøbing Mors,2024-04-08,Nykøbing M,https://www.jobindex.dk/vis-job/r12411502
Hotelmedarbejder - Morgenservering/rengøring,2024-04-08,Farsø,https://www.jobindex.dk/vis-job/r12411735
"Social og sundhedsassistent, hjælper og ufaglært afløser",2024-04-08,Aalestrup,https://www.jobindex.dk/vis-job/r12412970
Rengørings-serviceassistent til Hjørring Sydøstskole,2024-04-08,Hjørring,https://www.jobindex.dk/vis-job/r12411464
Sommerferieafløsere til Sygehjemmeplejen i Hjørring Kommune,2024-04-08,Hjørring,https://www.jobindex.dk/vis-job/r12412133
Studentermedhjælper til miljøområdet,2024-04-08,Hjørring,https://www.jobindex.dk/vis-job/r12412957
Sygeplejerske til Helhedstilbuddet – vikariat,2024-04-08,Hjørring,https://www.jobindex.dk/vis-job/r12411753
Hydrema Produktion i Støvring søger 2 nye kolleger til malerafdelingen,2024-04-08,Støvring,https://www.jobindex.dk/vis-job/r12411800
Vi søger en medarbejder under 18 år,2024-04-08,Frederikshavn,https://www.jobindex.dk/vis-job/r12411732
salgsassistent - afløser Frellsen Chokolade Frederikshavn,2024-04-08,Frederikshavn,https://www.jobindex.dk/vis-job/r12411787
Erfaren græspilot søges!,2024-04-08,Svenstrup J,https://www.jobindex.dk/vis-job/r12412968
Jurist inden for familie- og arveret,2024-04-08,Aalborg,https://www.jobindex.dk/vis-job/r12412960
Klitgaardens køkken mangler en ny kollega,2024-04-08,Skagen,https://www.jobindex.dk/vis-job/r12412888
Stafet For Livet Rebild søger tovholder til Underholdningsgruppen,2024-04-08,Skørping,https://www.jobindex.dk/vis-job/r12413020
lægesekretær søges til almen praksis i Aalborg SV,2024-04-08,Aalborg SV,https://www.jobindex.dk/vis-job/r12412178
Pædagog til Læsø Børnehus,2024-04-08,Læsø,https://www.jobindex.dk/vis-job/r12412967
Apple Tekniker - Evt Trainee mulighed for lederstilling,2024-04-08,Aalborg SV,https://www.jobindex.dk/vis-job/r12411373
Samsung og Motorola Tekniker Trainee Aalborg,2024-04-08,Aalborg SV,https://www.jobindex.dk/vis-job/r12411363
Årsvikariat dagvagter på Demenscenter Skovgården,2024-04-08,Hadsund,https://www.jobindex.dk/vis-job/r12411362
Årsvikariat nattevagt på Demenscenter Skovgården,2024-04-08,Hadsund,https://www.jobindex.dk/vis-job/r12411326
Social- og sundhedsassistent til Ansgarshjemmet,2024-04-08,Erslev,https://www.jobindex.dk/vis-job/r12411877
Sales Engineer,2024-04-08,Frederikshavn,https://www.jobindex.dk/vis-job/r12412090
Produktionsmedarbejdere til aftenholdet hos Nordic Seafood i Hirtshals,2024-04-08,Hirtshals,https://www.jobindex.dk/vis-job/r12411376
Produktionsmedarbejdere til elektronikvirksomhed,2024-04-08,Støvring,https://www.jobindex.dk/vis-job/r12411751
Dansklærer til Nordjyllands Idrætsefterskole Stidsholt,2024-04-08,Sæby,https://www.jobindex.dk/vis-job/r12412990
Afløser/ferieafløser søges fra den 1. maj 2024 eller efter aftale til Plejecenter Højgaarden,2024-04-08,Farsø,https://www.jobindex.dk/vis-job/r12412153
FOAs A-kasse Region Nord søger ny kollega,2024-04-08,Aalborg,https://www.jobindex.dk/vis-job/r12412992
Administrativ medarbejder på 12 timer om ugen,2024-04-08,Gistrup,https://www.jobindex.dk/vis-job/r12412984
"Afsnitsergoterapeut til Sengeafsnit NHH, Aalborg Universitetshospital, Syd",2024-04-08,Aalborg,https://www.jobindex.dk/vis-job/r12411851
Barselsvikariat - Farmaceut/lægemiddelakademiker til Cytostatikaproduktionen,2024-04-08,Aalborg,https://www.jobindex.dk/vis-job/r12412969
Farmakonom søges til Logistik,2024-04-08,Aalborg,https://www.jobindex.dk/vis-job/r12411654
Introduktionslæge i anæstesi ved Afdelingen for Anæstesi og Intensiv RHN i Hjørring,2024-04-08,Hjørring,https://www.jobindex.dk/vis-job/r12413109
"Klinisk underviser til Fysio- og Ergoterapiafdelingen, Aalborg Universitetshospital, Farsø",2024-04-08,Farsø,https://www.jobindex.dk/vis-job/r12411830
"Ledende oversygeplejerske til medicinsk afsnit 205A, 204A og Reumatologisk Ambulatorium",2024-04-08,Hjørring,https://www.jobindex.dk/vis-job/r12411421
Lægesekretær/Sundhedsadministrativ koordinator til Afdelingen for Diabetes og Hormonsygdomme/Steno Diabetes Center Nordjylland,2024-04-08,Aalborg,https://www.jobindex.dk/vis-job/r12412056
"Professorsekretær til Forskningsenheden i Anæstesi og Intensiv Afdeling, Aalborg Universitetshospital",2024-04-08,Aalborg,https://www.jobindex.dk/vis-job/r12412047
Pædagogisk medarbejder til nattevagt på Skovbrynet - Komplekse Udviklingsforstyrrelser - Sødisbakke,2024-04-08,Mariager,https://www.jobindex.dk/vis-job/r12413486
Sygeplejerske på Karkirurgisk afdeling,2024-04-08,Aalborg,https://www.jobindex.dk/vis-job/r12411574
Kundeorienteret servicemontør – entreprenørmateriel,2024-04-08,"Odense, Tilst, Taastrup, Aalborg",https://www.jobindex.dk/vis-job/r12413468
Koordinator for it-drift og support,2024-04-08,Aabybro,https://www.jobindex.dk/vis-job/r12412103
Friskolelærer til matematik og engelsk søges,2024-04-08,Dronninglund,https://www.jobindex.dk/vis-job/r12411617
Husassistent til rengøring og lidt køkken,2024-04-08,Hals,https://www.jobindex.dk/vis-job/r12411813
Er du på udkig efter spændende erfaring og ønsker du aktivt at sætte dit præg på servicen i vores charmerende restaurant,2024-04-08,Hirtshals,https://www.jobindex.dk/vis-job/r12412961
Social- og sundhedshjælper søges til fast aftenvagt stilling,2024-04-08,Aars,https://www.jobindex.dk/vis-job/r12412983
Rengøringspersonale søges til Skagen/Ålbæk/Bratten/Sæby,2024-04-08,Frederikshavn,https://www.jobindex.dk/vis-job/r12413494
Kirke- og kulturmedarbejder søges!,2024-04-08,Thisted,https://www.jobindex.dk/vis-job/r12411386
