Title,Published Date,Location,URL
Tide Bus Aalborg søger Karosseri-lærling (eller ufaglært medarbejder),2024-04-08,Gistrup,https://www.jobindex.dk/vis-job/r12413141
Tide Bus Aalborg søger Karosseri lærling (eller ufaglært medarbejder),2024-04-08,Gistrup,https://www.jobindex.dk/vis-job/r12412964
Butiksassistenter til WestWind Løkken,2024-04-08,Løkken,https://www.jobindex.dk/vis-job/r12411963
Dette er en test - Brønderslev,2024-04-08,Brønderslev,https://www.jobindex.dk/vis-job/r12411592
Salgsassistent under 18 år til bageriudsalget - Aalborg,2024-04-08,Aalborg,https://www.jobindex.dk/vis-job/r12411291
TANDLÆGEHUSET Hjørring søger tandplejer,2024-04-08,Hjørring,https://www.jobindex.dk/vis-job/r12413146
Tandlæge med lyst til det hele,2024-04-08,Thisted,https://www.jobindex.dk/vis-job/r12413147
"Introduktionsstilling i Akutmedicin, Akut- og Traumecenter, Aalborg Universitetshospital",2024-04-07,Aalborg,https://www.jobindex.dk/vis-job/r12410790
"Administrativ medarbejder til administrationen i Center for Familie, Sæby",2024-04-06,Sæby,https://www.jobindex.dk/vis-job/r12410722
Økonomikonsulent til Thisted,2024-04-06,Thisted,https://www.jobindex.dk/vis-job/r12410705
Afløsere på Demenscenter Skovgården,2024-04-06,Hadsund,https://www.jobindex.dk/vis-job/r12410742
1. assistent - Aalborg Ø,2024-04-06,Aalborg Øst,https://www.jobindex.dk/vis-job/r12409416
Butiksassistent - Hobro,2024-04-06,Hobro,https://www.jobindex.dk/vis-job/r12409415
"Ledende overlæge for TV-anæstesi (hjertekirurgi, klassisk thoraxkirurgi og vaskulær kirurgi) og TIA (Thorax Intensiv Afsnit),...",2024-04-06,Aalborg,https://www.jobindex.dk/vis-job/r12410737
GØR EN VERDEN TIL FORSKEL FOR ET ANDET MENNESKE,2024-04-06,Aalborg,https://www.jobindex.dk/vis-job/r12410625
Er du vores næste lastvognsmekaniker?,2024-04-06,Aars,https://www.jobindex.dk/vis-job/r12410741
Løn- og personalekonsulent til Løn og Personale teamet,2024-04-05,Frederikshavn,https://www.jobindex.dk/vis-job/r12407243
Børnehaven Thorsens Allé søger pædagoger,2024-04-05,Aalborg,https://www.jobindex.dk/vis-job/r12406568
Dagplejere til Aalborg kommune,2024-04-05,Aalborg,https://www.jobindex.dk/vis-job/r12406571
"Dagplejere til Kanalkvarteret, Sdr. Tranders og universitetsområdet",2024-04-05,Aalborg,https://www.jobindex.dk/vis-job/r12406572
Dagtilbud Øst søger en pædagogmedhjælper til Børnehuset Lille Tornhøj i en midlertidig stilling 37 timer,2024-04-05,Aalborg Øst,https://www.jobindex.dk/vis-job/r12406567
"Job- og Uddannelsesafdelingen, Jobcenter Aalborg, søger en beskæftigelseskonsulent med kombi-funktion til en fast stilling, 3...",2024-04-05,Aalborg,https://www.jobindex.dk/vis-job/r12407155
Jobcenterrådgiver/myndighedssagsbehandler søges til tidsbegrænset ansættelse i Job- og Integrationshuset,2024-04-05,Aalborg,https://www.jobindex.dk/vis-job/r12406569
Klinikassistent til Tandreguleringsklinikken (fast stilling),2024-04-05,Aalborg,https://www.jobindex.dk/vis-job/r12407160
Nibe Skole og DUS søger en leder til DUS- og indskolingsopgaver,2024-04-05,Nibe,https://www.jobindex.dk/vis-job/r12406570
"Nøddehuset, De Specialiserede Aflastningstilbud søger 3 pædagoger",2024-04-05,Vodskov,https://www.jobindex.dk/vis-job/r12407161
Pædagog til Landsbyordningen i Nøvling,2024-04-05,Gistrup,https://www.jobindex.dk/vis-job/r12407156
Pædagogmedhjælper til Børne- og ungehjem Vokseværket - fast stilling 37 timer ugentlig - hurtigst mulig eller senest 01.06.24,2024-04-05,Gistrup,https://www.jobindex.dk/vis-job/r12407158
Socialpædagoger og social- og sundhedsassistenter søges til døgntilbud Løvdal i Vodskov,2024-04-05,Vodskov,https://www.jobindex.dk/vis-job/r12406566
"Studentermedhjælper til Mobilitet og Infratruktur, By og Land, Aalborg Kommune",2024-04-05,Nørresundby,https://www.jobindex.dk/vis-job/r12407157
Vågen nattevagt til Børne- og ungehjem Vokseværket,2024-04-05,Gistrup,https://www.jobindex.dk/vis-job/r12407159
Elektronikmekaniker til 4. Transportkompagni ved 1. Logistikbataljon (genopslag),2024-04-05,Nørresundby,https://www.jobindex.dk/vis-job/r12406511
Mekaniker til 4. Transportkompagni ved Trænregimentet (genopslag),2024-04-05,Nørresundby,https://www.jobindex.dk/vis-job/r12406556
Militærjuridisk rådgiver søges til spændende stilling i Militærpolitiet (genopslag),2024-04-05,Nørresundby,https://www.jobindex.dk/vis-job/r12407230
IT-supporter til IT og Digitalisering,2024-04-05,Støvring,https://www.jobindex.dk/vis-job/r12407242
Skolepædagoger til Læringscenter Himmerland,2024-04-05,Kongerslev,https://www.jobindex.dk/vis-job/r12407240
Sommerferieafløser til Terndrup og Bælum Ældrecentrer,2024-04-05,Terndrup,https://www.jobindex.dk/vis-job/r12406597
Speciallærere til skoleafdelingen ved Læringscenter Himmerland,2024-04-05,Kongerslev,https://www.jobindex.dk/vis-job/r12407241
Produktionsmedarbejdere søges til fødevareproduktion,2024-04-05,Hjørring,https://www.jobindex.dk/vis-job/r12407151
Lagermedarbejder NAT - Vesthimmerland,2024-04-05,Vesthimmerland,https://www.jobindex.dk/vis-job/r12406544
Operatører produktion - Vesthimmerland,2024-04-05,Vesthimmerland,https://www.jobindex.dk/vis-job/r12406533
Elektriker til ladestandere,2024-04-05,"Nørresundby, Sæby, Aalborg, Aalborg SV",https://www.jobindex.dk/vis-job/r12407236
VORES HUSASSISTENT SØGER EN KOLLEGA 😊,2024-04-05,Aabybro,https://www.jobindex.dk/vis-job/r12406453
"Aalbæk Badehotel søger restaurantchef , som vil indgå i ledergruppen og være med til at skabe de hyggelige rammer og den afsl...",2024-04-05,Ålbæk,https://www.jobindex.dk/vis-job/r12406784
Tjener afløsere,2024-04-05,Ålbæk,https://www.jobindex.dk/vis-job/r12406867
Grå anlægsgartner med kendskab til det grønne,2024-04-05,Løgstør,https://www.jobindex.dk/vis-job/r12406327
Circle K Aalborg Ø søger en sælger på ca. 20 timer til deres team,2024-04-05,Aalborg Øst,https://www.jobindex.dk/vis-job/r12406962
Køkkenchef med passion for ledelse og godt værtsskab,2024-04-05,Aalborg Øst,https://www.jobindex.dk/vis-job/r12409268
Customer Service Assistant,2024-04-05,Nørresundby,https://www.jobindex.dk/vis-job/r12406903
"Elev, 365discount, Vejgaard (Aalborg)",2024-04-05,Aalborg,https://www.jobindex.dk/vis-job/r12406172
Laseroperatør søges,2024-04-05,Brønderslev,https://www.jobindex.dk/vis-job/r12407115
Sommerformidler søges til Limfjordsmuseet,2024-04-05,Løgstør,https://www.jobindex.dk/vis-job/r12409288
Underviser med fokus på Revit og AutoCAD,2024-04-05,Aalborg,https://www.jobindex.dk/vis-job/r12406248
Ejendomsmægler til John Frandsen Mariager,2024-04-05,Mariager,https://www.jobindex.dk/vis-job/r12406269
Familiehuset Vesthimmerland søger tilkaldevikar til vores Børnehus og Ungehus,2024-04-05,Aars,https://www.jobindex.dk/vis-job/r12407053
Rengøringsassistent til Jobcenter Thisted,2024-04-05,Hurup Thy,https://www.jobindex.dk/vis-job/r12406420
Rengøringsassistent til Hannæs Børnehus,2024-04-05,Hurup Thy,https://www.jobindex.dk/vis-job/r12406417
"Driftsleder til farestald i Nørhalne, Nordjylland",2024-04-05,Vadum,https://www.jobindex.dk/vis-job/r12406619
Mekaniker til fast faglærerstilling fra januar 2024,2024-04-05,Aars,https://www.jobindex.dk/vis-job/r12406821
Butiksmedhjælper til tøjbutik i Løkken,2024-04-05,Løkken,https://www.jobindex.dk/vis-job/r12406768
Salgsansvarlig til autocampere,2024-04-05,Støvring,https://www.jobindex.dk/vis-job/r12406994
Tjener søges til Ji Sushi,2024-04-05,Frederikshavn,https://www.jobindex.dk/vis-job/r12407017
JS VAGT søger vagter til Nordjylland,2024-04-05,Storvorde,https://www.jobindex.dk/vis-job/r12406469
"Rengøringsassistent i Aalborg - 11,75 timer pr. uge",2024-04-05,Aalborg,https://www.jobindex.dk/vis-job/r12406773
Rengøringsassistent i Aalborg - 5 timer pr. uge,2024-04-05,Aalborg SV,https://www.jobindex.dk/vis-job/r12406766
Chauffør søges til distribution af fryse- og kølevarer,2024-04-05,Hobro,https://www.jobindex.dk/vis-job/r12406945
Rengøringsassistent Fjelsø,2024-04-05,Aalestrup,https://www.jobindex.dk/vis-job/r12406363
Filetskærer i Fiskeindustrien - HANSTHOLM,2024-04-05,Thisted,https://www.jobindex.dk/vis-job/r12406240
Lagermedarbejder med Truckerfaring i Fiskeindustrien - HANSTHOLM,2024-04-05,Hanstholm,https://www.jobindex.dk/vis-job/r12406238
Medarbejder med Pakkerfaring i Fiskeindustrien - HANSTHOLM,2024-04-05,Hanstholm,https://www.jobindex.dk/vis-job/r12406237
Maskiningeniør,2024-04-05,Støvring,https://www.jobindex.dk/vis-job/r12406163
Ungarbejder - 7 timer - Hurup Thy,2024-04-05,Hurup Thy,https://www.jobindex.dk/vis-job/r12407946
Ungarbejder - 7 timer - Brønderslev,2024-04-05,Brønderslev,https://www.jobindex.dk/vis-job/r12407944
IT Tekniker Ålborg / Butikschef,2024-04-05,Aalborg SV,https://www.jobindex.dk/vis-job/r12406636
RENGØRINGSHJÆLP MED SORT BÆLTE I NULLERMÆND,2024-04-05,Nørresundby,https://www.jobindex.dk/vis-job/r12406986
Beskæftigelseskonsulent til fleksjobteam,2024-04-05,Hobro,https://www.jobindex.dk/vis-job/r12406631
"Butiksmedhjælper til Maxi Zoo Aars, 7 timer om ugen",2024-04-05,Aars,https://www.jobindex.dk/vis-job/r12409341
Bliv social- og sundhedshjælperelev i Morsø Kommune,2024-04-05,Nykøbing M,https://www.jobindex.dk/vis-job/r12406335
Servicemedarbejder søges til vores afdeling i Aalborg,2024-04-05,Aalborg SV,https://www.jobindex.dk/vis-job/r12406204
Lagerindkøber/Reservedelsekspedient søges til vores afdeling i Hjørring,2024-04-05,Hjørring,https://www.jobindex.dk/vis-job/r12406759
Udlejningskonsulent søges til vores afdeling i Hjørring,2024-04-05,Hjørring,https://www.jobindex.dk/vis-job/r12406874
"Organist til Vejgaard Kirke, Aalborg Budolfi Provsti",2024-04-05,Aalborg,https://www.jobindex.dk/vis-job/r12409350
MASKINBYGGER / SERVICESMEDARBEJDER,2024-04-05,Hadsund,https://www.jobindex.dk/vis-job/r12406902
"Servicemedarbejder, under 18 år",2024-04-05,Nørresundby,https://www.jobindex.dk/vis-job/r12407744
"Anæstesi og Intensiv Afdeling, Aalborg Universitetshospital søger 2 præ-kursister til afsnit for abdominalkirurgisk anæs",2024-04-05,Aalborg,https://www.jobindex.dk/vis-job/r12408243
KLINISK PSYKIATRISK SYGEPLEJERSKE MED SANS FOR UDVIKLING,2024-04-05,Aalborg,https://www.jobindex.dk/vis-job/r12406869
Sygeplejersker søges til tværgående funktion mellem ambulatorium og sengeafsnit i Hæmatologisk Afdeling,2024-04-05,Aalborg,https://www.jobindex.dk/vis-job/r12406806
"Trives du blandt dygtige, kompetente, humoristiske kollegaer?",2024-04-05,Aalborg,https://www.jobindex.dk/vis-job/r12406919
"Uklassificeret læge søges til Afdeling for Kvindesygdomme, Graviditet og Fødsel, Regionshospital Nordjylland, Hjørring",2024-04-05,Hjørring,https://www.jobindex.dk/vis-job/r12406463
Erfaren og selvstændig senior eller deltidsrengøringsassistent søges til Øland,2024-04-05,Brovst,https://www.jobindex.dk/vis-job/r12406850
Skatteministeriets koncern søger kontorelever - Åbner snart,2024-04-05,"Fredensborg, Fredericia, Haderslev, Herning, Hjørring, Horsens, Kastrup, Ringkøbing, Struer, Taastrup, Aarhus",https://www.jobindex.dk/vis-job/r12407825
Køkkenfaglig medarbejder med relevant uddannelse til Solstrålen SI,2024-04-05,Fjerritslev,https://www.jobindex.dk/vis-job/r12406939
SOSU-assistent til Vibedal Plejecenter,2024-04-05,Thisted,https://www.jobindex.dk/vis-job/r12406748
Lead Advisor/program manager with compliance,2024-04-05,Aalborg,https://www.jobindex.dk/vis-job/r12407204
Plejecenter Rosengården i hjertet af Sæby mangler en aftenvagt - SSA til fortrinsvis det somatiske afsnit med aflastning,2024-04-04,Sæby,https://www.jobindex.dk/vis-job/r12404029
Skoleleder til Sydskolen i Frederikshavn Kommune - Genopslag,2024-04-04,Frederikshavn,https://www.jobindex.dk/vis-job/r12404033
Børne- og ungerådgiver søges til Modtagelsen i Familiegruppe Øst,2024-04-04,Aalborg,https://www.jobindex.dk/vis-job/r12403343
Familiehuset Bisgård søger lige nu en kollega (familiebehandler) til en tidsbegrænset fuldtidsstilling fra 1.6.24 – 31.5.25,2024-04-04,Aalborg SV,https://www.jobindex.dk/vis-job/r12403966
Pædagog 32 t. til fast stilling i Børnehaven Henry,2024-04-04,Svenstrup J,https://www.jobindex.dk/vis-job/r12403341
Pædagog til en fast fultidsstilling i Børnehuset Blåkildevej,2024-04-04,Aalborg Øst,https://www.jobindex.dk/vis-job/r12403965
Social- og sundhedsassistent i aftenvagt med fokus på det sundhedsfaglige - Hjemmeplejen Tofthøj,2024-04-04,Storvorde,https://www.jobindex.dk/vis-job/r12403342
Socialpædagog,2024-04-04,Vodskov,https://www.jobindex.dk/vis-job/r12403967
Sygeplejerske til midlertidig stilling Sygeplejen Sydvest – Team-Kærby,2024-04-04,Aalborg SV,https://www.jobindex.dk/vis-job/r12403344
Automatiktekniker til Fregatten ESBERN SNARE (genopslag),2024-04-04,Frederikshavn,https://www.jobindex.dk/vis-job/r12403938
Dæksgast søges til Vedligeholdelsesbesætningen 1. Eskadre,2024-04-04,Frederikshavn,https://www.jobindex.dk/vis-job/r12403945
Forsyningsassistent til forsyningstjenesten ved Air transport Wing i Aalborg,2024-04-04,Vadum,https://www.jobindex.dk/vis-job/r12403949
Redningsudstyrstekniker til Life Support værkstedet ved Air Transport Wing i Aalborg,2024-04-04,Vadum,https://www.jobindex.dk/vis-job/r12403954
To erfarne og engagerede uddannelses- og erhvervsvejledere til Ungeenheden,2024-04-04,Støvring,https://www.jobindex.dk/vis-job/r12403358
Kreditorbogholder søges til 2 måneders vikariat,2024-04-04,Nørresundby,https://www.jobindex.dk/vis-job/r12403969
gravemaskine,2024-04-04,Klarup,https://www.jobindex.dk/vis-job/r12403927
Vi tager gerne imod din uopfordrede ansøgning hos Feriepartner Tversted/Ålbæk/Skagen,2024-04-04,Bindslev,https://www.jobindex.dk/vis-job/r12404389
Industriteknikerelev til Aalborg Universitet,2024-04-04,Aalborg,https://www.jobindex.dk/vis-job/r12404500
Pædagogisk assistent - 34 timer,2024-04-04,Aars,https://www.jobindex.dk/vis-job/r12403748
Beauté Pacifique søger bogholder/financial controller,2024-04-04,Hadsund,https://www.jobindex.dk/vis-job/r12403880
"Leder til fagligt videnscenter, Outsourcing",2024-04-04,Aalborg SV,https://www.jobindex.dk/vis-job/r12405962
Visitator begivenhedsvikariat - fokus på rehabilitering,2024-04-04,Dronninglund,https://www.jobindex.dk/vis-job/r12405120
"CABINN Aalborg søger afløsere til receptionen, nat og aften",2024-04-04,Aalborg,https://www.jobindex.dk/vis-job/r12403145
Studiejob: Junior Content Creator,2024-04-04,Sæby,https://www.jobindex.dk/vis-job/r12405308
Butiksmedarbejder under 18 år søges,2024-04-04,Aalborg,https://www.jobindex.dk/vis-job/r12403818
Fuldtidsmedarbejder til Nordens cooleste varemodtagelse,2024-04-04,Nørresundby,https://www.jobindex.dk/vis-job/r12403051
"Ferieafløser lager sommer 2024, Coop Logistik, Aalborg Distributionscenter",2024-04-04,Aalborg SV,https://www.jobindex.dk/vis-job/r12403214
"Dyrenes Beskyttelse søger frivillige i Thisted, Morsø, Viborg og Skive kommune",2024-04-04,"Morsø, Skive, Thisted, Viborg",https://www.jobindex.dk/vis-job/r12405995
SOMMERFERIE AFLØSER - omsorgshjælper,2024-04-04,Nørresundby,https://www.jobindex.dk/vis-job/r12403580
GoTutor søger lektiehjælpere,2024-04-04,"København, Odense, Region Sjælland, Aalborg, Aarhus",https://www.jobindex.dk/vis-job/r12405068
Kok søges til Gæstgivergaarden i Gandrup,2024-04-04,Gandrup,https://www.jobindex.dk/vis-job/r12403234
Elev - Hjørring,2024-04-04,Hjørring,https://www.jobindex.dk/vis-job/r12406020
Butiksmedarbejder under 18 år Butik · Kirppu Aalborg,2024-04-04,Aalborg,https://www.jobindex.dk/vis-job/r12406027
Kvik Aalborg resultatorienteret sælger med stort drive,2024-04-04,Aalborg,https://www.jobindex.dk/vis-job/r12406034
Butikassistent - 25 timer - Nykøbing Mors (Sommerferieafløser),2024-04-04,Nykøbing M,https://www.jobindex.dk/vis-job/r12405087
Butiksassistent - 30 timer - Frederikshavn,2024-04-04,Frederikshavn,https://www.jobindex.dk/vis-job/r12405086
Butiksassistent - 30 timer - Hadsund,2024-04-04,Hadsund,https://www.jobindex.dk/vis-job/r12405085
Salgsleder - 25 timer - Nykøbing Mors,2024-04-04,Nykøbing M,https://www.jobindex.dk/vis-job/r12405088
Salgsleder - 37 timer - Hirtshals,2024-04-04,Hirtshals,https://www.jobindex.dk/vis-job/r12405082
Ungarbejder - 7 timer - Hadsund,2024-04-04,Hadsund,https://www.jobindex.dk/vis-job/r12405084
Multi-Byg A/S søger 1 jord-/kloakmedarbejder,2024-04-04,Aalborg SV,https://www.jobindex.dk/vis-job/r12403484
Tømrersjak,2024-04-04,Aalborg SV,https://www.jobindex.dk/vis-job/r12403494
Ølandhus afdeling Marken i Aalborg kommune,2024-04-04,Storvorde,https://www.jobindex.dk/vis-job/r12403744
NOWAS A/S søger lagermedarbejder (barselsvikariat),2024-04-04,Løgstør,https://www.jobindex.dk/vis-job/r12403448
"Aalborg, Tornhøjvej - Butiksmedarbejder UNDER 18 år (sabbatår)",2024-04-04,Aalborg Øst,https://www.jobindex.dk/vis-job/r12404449
Utility Engineer,2024-04-04,Hjørring,https://www.jobindex.dk/vis-job/r12404583
Kontorelev til Taabbel's indkøbsafdeling,2024-04-04,Hanstholm,https://www.jobindex.dk/vis-job/r12403500
Butiksmedarbejder i Vorupør,2024-04-04,Thisted,https://www.jobindex.dk/vis-job/r12403606
"Er du ambulancebehandler, der ønsker at videreuddanne dig til paramediciner?",2024-04-04,Aalborg,https://www.jobindex.dk/vis-job/r12403695
"Klinisk underviser, fysioterapeut i Fysio- og Ergoterapiafdelingen, Aalborg Universitetshospital, Afsnit Syd",2024-04-04,Aalborg,https://www.jobindex.dk/vis-job/r12403844
Psykiatrien i Brønderslev søger medicinstuderende som lægevikar,2024-04-04,Brønderslev,https://www.jobindex.dk/vis-job/r12403322
Rengøringstekniker til Frederikshavn,2024-04-04,Frederikshavn,https://www.jobindex.dk/vis-job/r12403305
Spændende speciale søger ny kollega,2024-04-04,Aalborg,https://www.jobindex.dk/vis-job/r12403154
"Sygeplejerske søges til afsnit M5, Aalborg Universitetshospital, Thisted – palliation og neurorehabilitering",2024-04-04,Thisted,https://www.jobindex.dk/vis-job/r12403610
Tilkaldevikar til Sødisbakke med pædagogisk og omsorgs interesse,2024-04-04,Mariager,https://www.jobindex.dk/vis-job/r12403039
Uddannelsesstilling anæstesisygeplejerske,2024-04-04,Aalborg Øst,https://www.jobindex.dk/vis-job/r12403826
"Elektriker søges til opsætning af el-ladestandere - Scanel International A/S, Frederikshavn",2024-04-04,Frederikshavn,https://www.jobindex.dk/vis-job/r12403190
Sommerferieafløsere og tilkaldevikarer til plejecentrene i Jammerbugt kommune – er det mon dig?,2024-04-04,Brovst,https://www.jobindex.dk/vis-job/r12403565
Køkkenchef søges til Bistro V,2024-04-04,Hjørring,https://www.jobindex.dk/vis-job/r12403257
Senior project manager,2024-04-04,Frederikshavn,https://www.jobindex.dk/vis-job/r12403514
Afdelingsleder af Visitationsenheden i Center for Social- og Sundhedsområdet i Frederikshavn Kommune,2024-04-03,Frederikshavn,https://www.jobindex.dk/vis-job/r12400615
Pædagog til Børnehuset Ålbæk,2024-04-03,Ålbæk,https://www.jobindex.dk/vis-job/r12400616
Social- og sundhedsassistent til Abildparken Levebo i aftenvagt,2024-04-03,Frederikshavn,https://www.jobindex.dk/vis-job/r12401361
"Bofællesskaber, Bostøtte og Værested søger omsorgs- og pædagogmedhjælpere som faste afløsere til vores bofællesskaber",2024-04-03,Aalborg,https://www.jobindex.dk/vis-job/r12400565
DSA medarbejder (pædagogmedhjælper/pædagogisk assistent),2024-04-03,Nørresundby,https://www.jobindex.dk/vis-job/r12401305
Daginstitutionen Alfred Nobel søger pædagog på 37 timer ugentligt,2024-04-03,Aalborg Øst,https://www.jobindex.dk/vis-job/r12401304
Dagplejer i Vejgaard,2024-04-03,Aalborg,https://www.jobindex.dk/vis-job/r12400573
"Omsorgs- og pædagogmedhjælper søges til De Specialiserede Aflastningstilbud, Danahus",2024-04-03,Aalborg,https://www.jobindex.dk/vis-job/r12400564
Pædagog/pædagogisk assistent - 2 stillinger (1 fast stilling og 1 årsvikariat),2024-04-03,Nørresundby,https://www.jobindex.dk/vis-job/r12400562
Serviceminded assistent søges til borgerbetjening i Borgerservice,2024-04-03,Aalborg,https://www.jobindex.dk/vis-job/r12400566
Socialrådgivere / socialformidlere til 2 faste fuldtidsstillinger i Børneteamet i Familiegruppe Øst,2024-04-03,Aalborg,https://www.jobindex.dk/vis-job/r12400567
Specialist til Ledelsessekretariatet,2024-04-03,Aalborg,https://www.jobindex.dk/vis-job/r12401302
Uddannet og faglig dygtig pædagog til fast stilling 37 i Børnehaven Kridthuset søges pr. 1.maj 2024 eller snarest derefter,2024-04-03,Aalborg,https://www.jobindex.dk/vis-job/r12401301
"Ungetilbuddene Sofiebo og Visborggårdvej, samt Botilbuddet Tornhøjgaard søger personer med pædagogisk erfaring som sommerferi...",2024-04-03,Aalborg Øst,https://www.jobindex.dk/vis-job/r12401303
Virksomhedskonsulent til investeringsmodel i Job- og Aktivhuset – Jobcenter Aalborg,2024-04-03,Aalborg,https://www.jobindex.dk/vis-job/r12400563
Banjermester til Inspektionsfartøjet EJNAR MIKKELSEN (genopslag),2024-04-03,Frederikshavn,https://www.jobindex.dk/vis-job/r12401348
Elektroniktekniker og IT-supporter til Søværnets inspektionsskibe,2024-04-03,Frederikshavn,https://www.jobindex.dk/vis-job/r12400557
Erfarne kommunikationsgaster til søværnets inspektionsfartøjer af KNUD-kl. (genopslag),2024-04-03,Frederikshavn,https://www.jobindex.dk/vis-job/r12402937
Fregatten ABSALON søger Elektronikteknisk officer (EKO),2024-04-03,Frederikshavn,https://www.jobindex.dk/vis-job/r12401351
Kaptajn til Tjenestegrensinspektørelementet ved Trænregimentets Tjenestegrensafdeling (genopslag),2024-04-03,Nørresundby,https://www.jobindex.dk/vis-job/r12400560
SSA/SSH med hjertet på rette sted til Suldrup Ældrecentre,2024-04-03,Suldrup,https://www.jobindex.dk/vis-job/r12401346
Aluminiumssvejser til aftenhold søges til kunde nær Aalborg,2024-04-03,Aalborg SV,https://www.jobindex.dk/vis-job/r12401334
Dygtig industrioperatør søges på aftenhold til fødevarevirksomhed i Aars,2024-04-03,Aars,https://www.jobindex.dk/vis-job/r12401323
Mekanikere til opbygning af lastbiler søges til kunde nær Aalborg,2024-04-03,Aalborg SV,https://www.jobindex.dk/vis-job/r12401333
Montagemedarbejdere søges til virksomhed ved Hirtshals,2024-04-03,Hirtshals,https://www.jobindex.dk/vis-job/r12401322
Pladsmedarbejder søges til spændende virksomhed i region Nordjylland,2024-04-03,Aalborg SV,https://www.jobindex.dk/vis-job/r12402934
Rengøringsassistent søges til virksomhed i Aalborg,2024-04-03,Aalborg SV,https://www.jobindex.dk/vis-job/r12402936
Chauffør med CE-kort til Hobro,2024-04-03,"Hobro, Viborg, Aalborg SØ",https://www.jobindex.dk/vis-job/r12400607
reservedelsekspedient,2024-04-03,Svenstrup J,https://www.jobindex.dk/vis-job/r12401295
Ambitiøs og udadvendt kontorelev?,2024-04-03,Aalborg,https://www.jobindex.dk/vis-job/r12400672
Smed,2024-04-03,"USA, Aalborg",https://www.jobindex.dk/vis-job/r12402906
IT-SUPPORT-ELEV TIL AALBORG UNIVERSITET,2024-04-03,Aalborg,https://www.jobindex.dk/vis-job/r12401719
"Reannouncement - PhD Stipend in Precision health diagnostics for improved prediction, diagnosis and monitoring of adverse eff...",2024-04-03,Aalborg,https://www.jobindex.dk/vis-job/r12401721
Administrativ medarbejder til Pladsanvisningen i Jammerbugt Kommune,2024-04-03,Fjerritslev,https://www.jobindex.dk/vis-job/r12400693
Sekretær på Blidstrup Efterskole,2024-04-03,Øster Assels,https://www.jobindex.dk/vis-job/r12400448
Chauffør til Sug og Spulevogn,2024-04-03,Vadum,https://www.jobindex.dk/vis-job/r12400438
Vågen nattevagt til Bofællesskabet Grønningen,2024-04-03,Thisted,https://www.jobindex.dk/vis-job/r12401156
Barselsvikar til Beskæftigelse i Ungecenter Brønderslev,2024-04-03,Brønderslev,https://www.jobindex.dk/vis-job/r12400383
Ergoterapeut søges til træning og rehabilitering,2024-04-03,Brønderslev,https://www.jobindex.dk/vis-job/r12400244
Sommerferieafløsere og vikarer,2024-04-03,Brønderslev,https://www.jobindex.dk/vis-job/r12400346
Visitator,2024-04-03,Dronninglund,https://www.jobindex.dk/vis-job/r12400659
Cafe Vesterå søger nye kræfter til holdet (weekendarbejde) som tjener/bartender,2024-04-03,Aalborg,https://www.jobindex.dk/vis-job/r12400633
Rengøringsmedarbejdere søges,2024-04-03,Strandby,https://www.jobindex.dk/vis-job/r12400853
Carlog System Aabybro søger dynamisk sælger til vores ambitiøse team!,2024-04-03,Aabybro,https://www.jobindex.dk/vis-job/r12401279
Natportier afløser til Color Hotel Skagen,2024-04-03,Skagen,https://www.jobindex.dk/vis-job/r12403009
Marketingassistent med ansvar for opdatering af Coolshops website,2024-04-03,Nørresundby,https://www.jobindex.dk/vis-job/r12400514
Kitchen assistant / køkkenmedhjælper,2024-04-03,Aalborg,https://www.jobindex.dk/vis-job/r12400925
Tjenere / bartendere søges,2024-04-03,Aalborg,https://www.jobindex.dk/vis-job/r12400930
Morsø Bosteder søger pædagog til barselsvikariat,2024-04-03,Nykøbing M,https://www.jobindex.dk/vis-job/r12400445
FAGLÆRT KOK SØGES TIL FANDANKO - Familievenlige arbejdstider,2024-04-03,Aalborg,https://www.jobindex.dk/vis-job/r12400229
Kokke søges til Feriecenter Slettestrand,2024-04-03,Fjerritslev,https://www.jobindex.dk/vis-job/r12400161
FAST AFTENVAGT mødetid 15-23,2024-04-03,Nørresundby,https://www.jobindex.dk/vis-job/r12400662
"Barselsvikar, Pædagog, Sosu, Pæd ass. el lignende",2024-04-03,Hadsund,https://www.jobindex.dk/vis-job/r12400499
Fonden Buddumhuse søger 1 ny medarbejder til voksenområdet,2024-04-03,Hadsund,https://www.jobindex.dk/vis-job/r12400279
Er du vores nye VVS-ingeniør?,2024-04-03,Aalborg SV,https://www.jobindex.dk/vis-job/r12400153
Teknisk servicemedarbejder til Koldby Skole,2024-04-03,Hurup Thy,https://www.jobindex.dk/vis-job/r12400840
Butiksassistent til ny butik i Thisted (deltid),2024-04-03,Thisted,https://www.jobindex.dk/vis-job/r12401204
Butiksbestyrer til ny butik i Thisted,2024-04-03,Thisted,https://www.jobindex.dk/vis-job/r12401202
Hawkantsbørn søger pædagog til et barselsvikariat,2024-04-03,Hanstholm,https://www.jobindex.dk/vis-job/r12400464
